Song Title;Artist;Lyrics;bpm;Push myself score;Have fun score;Stress relief score;Relax / focus score;Get motivated score;Spotify URI
Winner;Jamie Foxx, Justin Timberlake, T.I.;"Winner Lyrics[Intro: T.I., Jamie Foxx & Justin Timberlake]
T.I.P. (Yo, uh)
Ay Jamie, JT (Oh)
I'm 'bout to get back hot again man
You know I'm fresh out that thang, let go
You know you lookin at a winner, winner, winner
I'm so up there and so out there, you so not here
Hey, hey, you see we so up there and we so out there
Uh, yeah, let me get it right here first. Hey!

[Verse 1: Justin Timberlake]
I'm wakin', up in the morning
Hustlin' to the stage, if I've been performin'
Bustlin' through the hay and bustin' the door in
Lately nothin' messes up my step and scorin'
And speakin' of the Misses, I'm watchin' 'em pour in (Uh)
Just like a drink that I'm enjoyin'
And don't mean bottles, you welcome to join in
Just look at me soarin', feelin' like Jordan
[Bridge: Justin Timberlake]
(Aaah-ah) Hold up I ain't finished yet
On the top but you just don't get it yet
I don't get cut, I make 'em cut the check
Can't hear me in the stands, let me say it again
(Aaah-ah) You ain't heard I'm the shit
On the top but you just don't get it yet
I never got cut but I make 'em cut the check
So hate on but guess what

[Chorus: Justin Timberlake & Jamie Foxx]
I feel like I can't miss
I know they want me to fall
But ain't nothin bigger than this
So just pass me the ball
You know you lookin at a winner, winner, winner
I can't miss, can't lose, can't miss
You know you lookin at winner, winner, winner
`Cause I'm a winner, yeah I'm a winner

[Verse 2: Jamie Foxx]
I'm steppin' out in the evening
Keep winnin' and screamin'
You gotta be cheatin' but I'm so breezy
I make this look easy
And y'all thinkin' I'm seasoned, you gotta believe me
I went from TVs to screens to DVDs
To CDs to MP3s overseas
I got, no time, the talking is boring
Just look at me soarin', feeling like Jordan
You might also like[Bridge: Jamie Foxx]
(Aaah-ah) Hold up I ain't finished yet
On the top but you just don't get it yet
I never got cut, I make 'em cut the check
Can't hear me in the stands, let me say it again
(Aaah-ah) You ain't heard I'm the shit
On the top but you just don't get it yet
I never got cut but I make 'em cut the check
So hate on but guess what

[Chorus: Justin Timberlake & Jamie Foxx]
I feel like I can't miss
I know they want me to fall
But ain't nothin bigger than this
So just pass me the ball
You know you lookin at a winner, winner, winner
I can't miss, can't lose, can't miss
You know you lookin at winner, winner, winner
`Cause I'm a winner, yeah I'm a winner

[Verse 3: T.I.]
That's right, you see the, Porsche Panamera, got 'em in hysteria
The turbo super fast and that McLaren even scarier
Hear me turnin' corners, burnin' rubber in your area
I'm hard to follow once I pop the clutch and hit the throttle
I'm recession proof, I don't run to money, money run to me
In this economy, guess I'm considered an anomaly
Bugattis, Maseratis, new Ferraris, I got one of each
My future bright, tight like the pussy out in front of me
Turn pain to progression in every studio session
Passion into perfection, to failure I'm an exception
Fuck if you wanna lose, to battle me is a blessing
You couldn't die at the hands of a better man
I ran from the bottom to the best, no Auto-Tune
Been in the lead, say you seen King follow whom
Never that, I'm the freshest go ask whoever that
King back, money long as a old Cadillac
[Chorus: Justin Timberlake & Jamie Foxx]
I feel like I can't miss
I know they want me to fall
But ain't nothin bigger than this
So just pass me the ball
You know you lookin at a winner, winner, winner
I can't miss, can't lose, can't miss
You know you lookin at winner, winner, winner
`Cause I'm a winner, yeah I'm a winner

[Outro: T.I.]
Hey man, you thought a little vacation was gonna hold me back homeboy
Man, I'm back man, brighter than ever
You understand that?
If you didn't like me then, ha, you gonna hate me now nigga3Embed";90;4;0;1;0;2;spotify:track:12PNcnMsjsZ3eHm62t8hiy
Last Friday Night (T.G.I.F.);Katy Perry;"TranslationsPortuguês????????Last Friday Night (T.G.I.F.) Lyrics[Verse 1]
There's a stranger in my bed
There's a pounding in my head
Glitter all over the room
Pink flamingos in the pool
I smell like a minibar
DJ's passed out in the yard
Barbies on the barbecue
This a hickey or a bruise?

[Pre-Chorus]
Pictures of last night ended up online
I'm screwed, oh well
It's a blacked out blur, but I'm pretty sure it ruled
Damn
[Chorus]
Last Friday night
Yeah, we danced on tabletops
And we took too many shots
Think we kissed, but I forgot
Last Friday night
Yeah, we maxed our credit cards
And got kicked out of the bar
So we hit the boulevard
Last Friday night
We went streaking in the park
Skinny dipping in the dark
Then had a ménage à trois
Last Friday night
Yeah, I think we broke the law
Always say we're gonna stop-op, oh-woah

[Post-Chorus]
But this Friday night
Do it all again
But this Friday night
Do it all again

[Verse 2]
Trying to connect the dots
Don't know what to tell my boss
Think the city towed my car
Chandelier is on the floor
Ripped my favorite party dress
Warrant's out for my arrest
Think I need a ginger ale
That was such an epic fail
You might also like[Pre-Chorus]
Pictures of last night ended up online
I'm screwed, oh well
It's a blacked out blur, but I'm pretty sure it ruled
Damn

[Chorus]
Last Friday night
Yeah, we danced on tabletops
And we took too many shots
Think we kissed, but I forgot
Last Friday night
Yeah, we maxed our credit cards
And got kicked out of the bar
So we hit the boulevard
Last Friday night
We went streaking in the park
Skinny dipping in the dark
Then had a ménage à trois
Last Friday night
Yeah, I think we broke the law
Always say we're gonna stop-op, oh-woah

[Post-Chorus]
But this Friday night
Do it all again (Do it all again)
This Friday night
Do it all again (Do it all again)
This Friday night
[Bridge]
T.G.I.F., T.G.I.F., T.G.I.F
T.G.I.F., T.G.I.F., T.G.I.F

[Saxophone Solo]

[Chorus]
Last Friday night
Yeah, we danced on tabletops
And we took too many shots
Think we kissed, but I forgot
Last Friday night
Yeah, we maxed our credit cards
And got kicked out of the bar
So we hit the boulevard
Last Friday night
We went streaking in the park
Skinny dipping in the dark
Then had a ménage à trois
Last Friday night
Yeah, I think we broke the law
Always say we're gonna stop-op, oh-woah

[Post-Chorus]
But this Friday night
Do it all again

[Produced by Dr. Luke and Max Martin]31Embed";126;0;2;0;0;0;spotify:track:31kUJ6TBHOICknBrFugOvI
Firework;Katy Perry;"TranslationsPortuguêsFirework Lyrics[Verse 1]
Do you ever feel like a plastic bag
Drifting through the wind, wanting to start again?
Do you ever feel, feel so paper-thin
Like a house of cards, one blow from cavin' in?
Do you ever feel already buried deep?
Six feet under screams, but no one seems to hear a thing
Do you know that there's still a chance for you?
'Cause there's a spark in you

[Pre-Chorus]
You just gotta ignite the light
And let it shine
Just own the night
Like the Fourth of July
[Chorus]
'Cause baby, you're a firework
Come on show 'em what you're worth
Make 'em go, ""Awe, awe, awe""
As you shoot across the sky-y-y
Baby, you're a firework
Come on, let your colors burst
Make 'em go, ""Awe, awe, awe""
You're gonna leave 'em all in awe, awe, awe

[Verse 2]
You don't have to feel like a waste of space
You're original, cannot be replaced
If you only knew what the future holds
After a hurricane comes a rainbow
Maybe a reason why all the doors are closed
So you could open one that leads you to the perfect road
Like a lightning bolt, your heart will glow
And when it's time, you'll know

[Pre-Chorus]
You just gotta ignite the light
And let it shine
Just own the night
Like the Fourth of July
You might also like[Chorus]
'Cause baby, you're a firework
Come on, show 'em what you're worth
Make 'em go, ""Awe, awe, awe""
As you shoot across the sky-y-y
Baby, you're a firework
Come on, let your colors burst
Make 'em go, ""Awe, awe, awe""
You're gonna leave 'em all in awe, awe, awe

[Bridge]
""Boom, boom, boom""
Even brighter than the moon, moon, moon
It's always been inside of you, you, you
And now it's time to let it throu-ou-ough

[Chorus]
'Cause baby, you're a firework
Come on show 'em what you're worth
Make 'em go, ""Awe, awe, awe,""
As you shoot across the sky-y-y
Baby, you're a firework
Come on, let your colors burst
Make 'em go, ""Awe, awe, awe""
You're gonna leave 'em all in awe, awe, awe
[Outro]
""Boom, boom, boom""
Even brighter than the moon, moon, moon
""Boom, boom, boom""
Even brighter than the moon, moon, moon86Embed";124;1;0;3;0;0;spotify:track:3oHNJECGN3bBoGXejlw2b1
Roar;Katy Perry;"TranslationsPortuguês????????FrançaisRoar Lyrics[Verse 1]
I used to bite my tongue and hold my breath
Scared to rock the boat and make a mess
So I sat quietly, agreed politely
I guess that I forgot I had a choice
I let you push me past the breaking point
I stood for nothing, so I fell for everything

[Pre-Chorus]
You held me down, but I got up (Hey)
Already brushing off the dust
You hear my voice, you hear that sound
Like thunder, gonna shake the ground
You held me down, but I got up (Hey)
Get ready 'cause I've had enough
I see it all, I see it now
[Chorus]
I got the eye of the tiger, a fighter
Dancing through the fire
'Cause I am a champion, and you're gonna hear me roar
Louder, louder than a lion
'Cause I am a champion, and you're gonna hear me roar

[Post-Chorus]
Oh-oh-oh-oh-oh-oh-oh
Oh-oh-oh-oh-oh-oh-oh
Oh-oh-oh-oh-oh-oh-oh
You're gonna hear me roar

[Verse 2]
Now I'm floating like a butterfly
Stinging like a bee, I earned my stripes
I went from zero, to my own hero

[Pre-Chorus]
You held me down, but I got up (Hey)
Already brushing off the dust
You hear my voice, you hear that sound
Like thunder, gonna shake the ground
You held me down, but I got up (Got up)
Get ready 'cause I've had enough
I see it all, I see it now
You might also like[Chorus]
I got the eye of the tiger, a fighter
Dancing through the fire
'Cause I am a champion, and you're gonna hear me roar
Louder, louder than a lion
'Cause I am a champion, and you're gonna hear me roar

[Post-Chorus]
Oh-oh-oh-oh-oh-oh-oh
Oh-oh-oh-oh-oh-oh-oh
Oh-oh-oh-oh-oh-oh-oh
You're gonna hear me roar
Oh-oh-oh-oh-oh-oh-oh
Oh-oh-oh-oh-oh-oh-oh
(You'll hear me roar)
Oh-oh-oh-oh-oh-oh-oh
You're gonna hear me roar

[Bridge]
Roar, roar, roar, roar, roar

[Chorus]
I got the eye of the tiger, a fighter
Dancing through the fire
'Cause I am a champion, and you're gonna hear me roar
Oh, louder, louder than a lion
'Cause I am a champion, and you're gonna hear me roar
[Post-Chorus]
Oh-oh-oh-oh-oh-oh-oh
Oh-oh-oh-oh-oh-oh-oh
Oh-oh-oh-oh-oh-oh-oh (Yeah)
You're gonna hear me roar
Oh-oh-oh-oh-oh-oh-oh
Oh-oh-oh-oh-oh-oh-oh
(You'll hear me roar)
Oh-oh-oh-oh-oh-oh-oh
You're gonna hear me roar
[Video Directed by Grady Hall & Mark Kudsi]
[Produced by Dr. Luke & Max Martin]98Embed";90;1;1;0;0;1;spotify:track:1mXuMM6zjPgjL4asbBsgnt
California Gurls;Katy Perry;"TranslationsEspañolPortuguêsCalifornia Gurls Lyrics[Intro: Snoop Dogg]
Greetings, loved ones
Let's take a journey

[Verse 1: Katy Perry]
I know a place where the grass is really greener
Warm, wet and wild
There must be something in the water
Sipping gin and juice
Laying underneath the palm trees (Undone)
The boys break their necks
Tryna creep a little sneak peek (At us)
[Pre-Chorus: Katy Perry]
You could travel the world
But nothing comes close to the golden coast
Once you party with us
You'll be falling in love
Oh-oh-oh-oh-oh-oh-oh

[Chorus: Katy Perry]
California girls, we're unforgettable
Daisy Dukes, bikinis on top
Sun-kissed skin so hot, we'll melt your popsicle
Oh-oh-oh-oh-oh-oh, oh, oh-oh-oh-oh-oh
California girls, we're undeniable
Fine, fresh, fierce, we got it on lock
West Coast represent, now put your hands up
Oh-oh-oh-oh-oh-oh, oh, oh-oh-oh-oh-oh

[Verse 2: Katy Perry]
Sex (Sex) on the beach
We don't mind sand in our stilettos
We freak in my Jeep
Snoop Doggy Dogg on the stereo, oh-oh

[Pre-Chorus: Katy Perry]
You could travel the world (You could travel the world)
But nothing comes close to the Golden Coast
Once you party with us (Once you party with us)
You'll be falling in love
Oh-oh-oh-oh-oh-oh-oh
You might also like[Chorus: Katy Perry & (Snoop Dogg)]
California girls, we're unforgettable (California)
Daisy Dukes, bikinis on top
Sun-kissed skin so hot, we'll melt your popsicle
Oh-oh-oh-oh-oh,oh,oh-oh-oh-oh-oh-oh
California girls (California), we're undeniable
Fine, fresh, fierce, we got it on lock
West Coast represent (West Coast), now put your hands up
Oh-oh-oh-oh-oh-oh, oh, oh-oh-oh-oh-oh

[Verse 3: Snoop Dogg & Katy Perry, Both]
Toned, tan, fit and ready
Turn it up 'cause it's getting heavy
Wild, wild, West Coast
These are the girls I love the most
I mean the ones, I mean like she's the one
Kiss her, touch her, squeeze her buns (Uh!)
The girl's a freak
She drive a Jeep and live on the beach
I'm okay, I won't play
I love the Bay just like I love L.A
Venice Beach and Palm Springs
Summertime is everything
Homeboys banging out
All that ass hanging out
Bikinis, zucchinis, martinis, no weenies
Just the king and a queenie
Katy, my lady (Yeah?)
Lookie here, baby (Uh-huh)
I'm all up on ya
'Cause you representin' California (Oh-oh, yeah)
[Chorus: Katy Perry & (Snoop Dogg)]
California girls, we're unforgettable
Daisy Dukes, bikinis on top
Sun-kissed skin so hot, we'll melt your popsicle
Oh-oh-oh-oh-oh-oh, oh, oh-oh-oh-oh-oh (Come on, come on)
California girls, we're undeniable
Fine, fresh, fierce, we got it on lock
West Coast represent (West Coast, West Coast)
Now put your hands up (Aye, aye)
Oh-oh-oh-oh-oh-oh, oh, oh-oh-oh-oh-oh

[Outro: Snoop Dogg & (Vocoder)]
(California, California girls)
California girls, man
(California) Hahahaha
(California Girls)
I really wish you all could be California girls32Embed";125;0;2;3;1;0;spotify:track:6F5c58TMEs1byxUstkzVeM
Without Me;Halsey;"TranslationsTürkçeEspañolPortuguêsItalianoMagyarFrançais?????DanskWithout Me Lyrics[Verse 1]
Found you when your heart was broke
I filled your cup until it overflowed
Took it so far to keep you close (Keep you close)
I was afraid to leave you on your own (Ooh)

[Pre-Chorus]
I said I'd catch you if you fall (Fall)
And if they laugh, then fuck 'em all (All)
And then I got you off your knees
Put you right back on your feet
Just so you could take advantage of me
[Chorus]
Tell me, how's it feel sittin' up there?
Feelin' so high, but too far away to hold me
You know I'm the one who put you up there
Name in the sky, does it ever get lonely?
Thinkin' you could live without me
Thinkin' you could live without me
Baby, I'm the one who put you up there
I don't know why (Yeah, I don't know why)
Thinkin' you could live without me
Live without me
Baby, I'm the one who put you up there
I don't know why (I don't know why, yeah, yeah)

[Verse 2]
Gave love 'bout a hundred tries (Hundred tries)
Just runnin' from the demons in your mind
Then I took yours and made 'em mine (Mine)
I didn't notice 'cause my love was blind

[Pre-Chorus]
Said I'd catch you if you fall (Fall)
And if they laugh, then fuck 'em all (All)
And then I got you off your knees
Put you right back on your feet
Just so you could take advantage of me
You might also like[Chorus]
Tell me, how's it feel sittin' up there?
Feelin' so high, but too far away to hold me
You know I'm the one who put you up there
Name in the sky, does it ever get lonely?
Thinkin' you could live without me
Thinkin' you could live without me
Baby, I'm the one who put you up there
I don't know why (Yeah, I don't know why)
Thinkin' you could live without me
Live without me
Baby, I'm the one who put you up there
I don't know why, yeah

[Bridge]
You don't have to say just what you did (What you did)
I already know (I know)
I had to go and find out from them (Oh-woah)
So tell me, how's it feel? (Oh-woah)

[Chorus]
Tell me, how's it feel sittin' up there?
Feelin' so high, but too far away to hold me
You know I'm the one who put you up there
Name in the sky, does it ever get lonely?
Thinkin' you could live without me
Thinkin' you could live without me
Baby, I'm the one who put you up there
I don't know why (Yeah, I don't know why)197Embed";136;2;0;2;1;0;spotify:track:3f7gYMirBEKuc57218BjOY
no tears left to cry;Ariana Grande;"TranslationsTürkçe???????ItalianoDeutschFrançaisNederlands??no tears left to cry Lyrics[Intro]
Right now, I'm in a state of mind
I wanna be in like all the time
Ain't got no tears left to cry
So I'm pickin' it up, pickin' it up
I'm lovin', I'm livin' (Oh hey), I'm pickin' it up
I'm pickin' it up, pickin' it up (Yeah)
I'm lovin', I'm livin', I'm pickin' it up (Oh, yeah)

[Refrain]
I'm pickin' it up (Yeah), pickin' it up (Yeah)
Lovin', I'm livin', so we turnin' up (We turnin' it up)
Yeah, we turnin' it up
[Verse 1]
Ain't got no tears in my body
I ran out, but boy, I like it, I like it, I like it
Don't matter how, what, where, who tries it
We out here vibin', we vibin', we vibin'

[Pre-Chorus]
Comin' out, even when it's rainin' down
Can't stop now, can't stop so shut your mouth
Shut your mouth, and if you don't know
Then now you know it, babe
Know it, babe, yeah

[Chorus]
Right now, I'm in a state of mind
I wanna be in like all the time
Ain't got no tears left to cry
So I'm pickin' it up, pickin' it up (Oh yeah)
I'm lovin', I'm livin', I'm pickin' it up
Oh, I just want you to come with me (Ooh)
We on another mentality
Ain't got no tears left to cry (To cry)
So I'm pickin' it up, pickin' it up (Oh yeah)
I'm lovin', I'm livin', I'm pickin' it up (Oh)

[Refrain]
Pickin' it up (Yeah), pickin' it up (Yeah)
Lovin', I'm livin', so we turnin' up (We turnin' it up)
Yeah, we turnin' it up
You might also like[Verse 2]
They point out the colors in you, I see 'em too
And, boy, I like 'em, I like 'em, I like 'em
We way too fly to partake in all this hate
We out here vibin', we vibin', we vibin'

[Pre-Chorus]
Comin' out, even when it's rainin' down
Can't stop now, can't stop, so shut your mouth
Shut your mouth, and if you don't know
Then now you know it, babe
Know it, babe, yeah

[Chorus]
Right now, I'm in a state of mind
I wanna be in like all the time
Ain't got no tears left to cry
So I'm pickin' it up, pickin' it up (Oh yeah)
I'm lovin', I'm livin', I'm pickin' it up
Oh, I just want you to come with me (Ooh)
We on another mentality
Ain't got no tears left to cry (To cry)
So I'm pickin' it up, pickin' it up (Oh yeah)
I'm lovin', I'm livin', I'm pickin' it up

[Bridge]
Comin' out, even when it's rainin' down
Can't stop now (Hmm, oh)
Shut your mouth
Ain't got no tears left to cry
Oh-yeah, oh, yeah
[Chorus]
Oh, I just want you to come with me (Me)
We on another mentality
Ain't got no tears left to cry (Cry)
So I'm pickin' it up (Yeah), pickin' it up (Oh, yeah)
I'm lovin', I'm livin', I'm pickin' it up (Pickin' it up)

[Refrain]
Pickin' it up (Hmm), pickin' it up (Hmm)
Lovin', I'm livin', so we turnin' up (Hmm)
Yeah, we turnin' it up314Embed";122;0;0;1;1;0;spotify:track:6FZDfxM3a3UCqtzo5pxSLZ
breathin;Ariana Grande;"TranslationsTürkçe???????PortuguêsItalianoAriana Grande - breathin (????? ??????Français?????Ariana Grande - breathin (Nederlandse Vertaling)??breathin Lyrics[Intro]
??lacigam gnihtemos od oT
??thgin laiceps ruoy s'thginot tuB

[Verse 1]
Some days, things just take
Way too much of my energy
I look up and the whole room's spinning
You take my cares away
I can so over-complicate, people tell me to medicate
[Pre-Chorus]
Feel my blood runnin', swear the sky's fallin'
I know that all this shit's fabricated, mmm
Time goes by and I can't control my mind
Don't know what else to try, but you tell me every time

[Chorus]
Just keep breathin' and breathin' and breathin' and breathin'
And oh, I gotta keep, keep on breathin'
Just keep breathin' and breathin' and breathin' and breathin'
And oh, I gotta keep, keep on breathin', mmm-mmm

[Verse 2]
Sometimes it's hard to find
Find my way up into the clouds
Tune it out, they can be so loud
You remind me of a time
When things weren't so complicated
All I need is to see your face

[Pre-Chorus]
Feel my blood runnin', swear the sky's fallin'
I know that all this shit's fabricated, mmm
Time goes by and I can't control my mind
Don't know what else to try, but you tell me every time
You might also like[Chorus]
Just keep breathin' and breathin' and breathin' and breathin'
And oh, I gotta keep, I keep on breathin'
Just keep breathin' and breathin' and breathin' and breathin'
And oh, I gotta keep, I keep on breathin', mmm, yeah

[Bridge]
My, my air, my, my air
My, my air, my air
My, my air, my, my air
My, my air, yeah

[Chorus]
Just keep breathin' and breathin' and breathin' and breathin'
And oh, I gotta keep, I keep on breathin'
Just keep breathin' and breathin' and breathin' and breathin'
And oh, I gotta keep, I keep on breathin', mmm, yeah

[Outro]
Feel my blood runnin', swear the sky's fallin', oh, whoa
I keep on breathin', oh yeah
Time goes by and I can't control my mind
I keep on breathin', mmm, yeah173Embed";100;3;0;2;1;0;spotify:track:2qT1uLXPVPzGgFOx4jtEuo
Break Free;Ariana Grande;"TranslationsEspañolPortuguêsFrançaisBreak Free Lyrics[Click here to read how Zedd and Ariana Grande got together to make Break Free]

[Verse 1]
If you want it, take it
I should've said it before
Tried to hide it, fake it
I can't pretend anymore

[Pre-Chorus]
I only wanna die alive
Never by the hands of a broken heart
I don't wanna hear you lie tonight
Now that I've become who I really am
[Chorus]
This is the part when I say I don't want ya
I'm stronger than I've been before
This is the part when I break free
'Cause I can't resist it no more
This is the part when I say I don't want ya
I'm stronger than I've been before
This is the part when I break free
'Cause I can't resist it no more

[Verse 2]
You were better, deeper
I was under your spell, yeah
Like a deadly fever, yeah, babe
On the highway to hell, yeah

[Pre-Chorus]
I only wanna die alive
Never by the hands of a broken heart
I don't wanna hear you lie tonight
Now that I've become who I really am

[Chorus]
This is the part when I say I don't want ya
I'm stronger than I've been before
This is the part when I break free
'Cause I can't resist it no more
This is the part when I say I don't want ya
I'm stronger than I've been before
This is the part when I break free
'Cause I can't resist it no more
You might also like[Bridge]
No more, baby
Ooh-ooh-ooh
Thought of your body, I came alive
It was lethal, it was fatal
In my dreams, it felt so right
But I woke up every time
Ooh, baby

[Chorus]
This is the part when I say I don't want ya
I'm stronger than I've been before (Ooh-ooh-ooh-ooh)
This is the part when I break free
'Cause I can't resist it no more
This is (This is) the part when I say I don't want ya
I'm stronger than I've been before
This is the part when I break free
'Cause I can't resist it no more319Embed";130;0;1;1;0;0;spotify:track:4OafepJy2teCjYJbvFE60J
