Song Title;Artist;Lyrics;bpm;Push myself score;Have fun score;Stress relief score;Relax / focus score;Get motivated score;Spotify URI
Lush Life;Zara Larsson;"TranslationsEspañolLush Life Lyrics[Chorus]
I live my day as if it was the last
Live my day as if there was no past
Doin' it all night, all summer
Doin' it the way I wanna
Yeah, I'ma dance my heart out 'til the dawn
But I won't be done when mornin' comes
Doin' it all night, all summer
Gonna spend it like no other

[Verse 1]
It was a crush
But I couldn't, couldn't get enough
It was a rush
But I gave it up
It was a crush
Now, I might've went and said too much
But, that's all it was
So, I gave it up
[Chorus]
I live my day as if it was the last
Live my day as if there was no past
Doin' it all night, all summer
Doin' it the way I wanna
Yeah, I'ma dance my heart out 'til the dawn
But I won't be done when mornin' comes
Doin' it all night, all summer
Gonna spend it like no other

[Verse 2]
It was a crush
I kept sayin' I'ma stay in touch
But that thing went bust
So I gave it up, ooh
No tricks, no bluff
I'm just better off without them cuffs
Yeah, the sun won't set on us
Ooh-ooh-ooh-ooh, yeah, yeah

[Bridge]
Went low, went high
Still waters run dry
Gotta get back in the groove
I ain't ever worried
Went low, went high, what matters is now
Gettin' right back in the mood
You might also like[Chorus]
I live my day as if it was the last
Live my day as if there was no past
Doin' it all night, all summer
Doin' it the way I wanna
Yeah, I'ma dance my heart out 'til the dawn
But I won't be done when mornin' comes
Doin' it all night, all summer
Gonna spend it like no other
Now I've found another crush
The lush life's given me a rush
Had one chance to make me blush
Second time is one too late
Now I've found another crush
The lush life's given me a rush
Had one chance to make me blush
Second time is one too late

[Interlude]
Ooh, ooh, woah, ooh, ooh

[Chorus]
I live my day as if it was the last
Live my day as if there was no past
Doin' it all night, all summer
Doin' it the way I wanna
Yeah, I'ma dance my heart out 'til the dawn
But I won't be done when mornin' comes
Doin' it all night, all summer
Gonna spend it like no other
Now I've found another crush
The lush life's given me a rush
Had one chance to make me blush
Second time is one too late
Now I've found another crush
The lush life's given me a rush
Had one chance to make me blush
Second time is one too late53Embed";98;0;1;2;0;0;spotify:track:2dpaYNEQHiRxtZbfNsse99
Mika;Popular Song;"TranslationsEspañolPortuguêsMIKA - Popular Song (Single Version) (ft. Ariana Grande) (Traduction Française)Popular Song (Single Version) Lyrics[Intro: Ariana Grande]
La-la, la-la

[Verse 1: Ariana Grande, MIKA & Both]
You were the popular one, the popular chick
It is what it is, now I'm popular-ish
Standin' on the field with your pretty pompom
Now you're workin' at the movies sellin' popular corn
I coulda been a mess, but I never went wrong
'Cause I'm puttin' down my story in a popular song (La-la, la-la)
Ah-ah, I said I'm puttin' down my story in a popular song
[Pre-Chorus: MIKA & Ariana Grande]
My problem, I never was a model
I never was a scholar, but you were always popular
You were singin' all the songs I don't know
Now you're in the front row 'cause my song is popular

[Chorus: MIKA & Both]
Popular, I know about popular
It's not about who you are or your fancy car
You're only ever who you were
Popular, I know about popular
And all that you have to do is be true to you
That's all you ever need to know

[Post-Chorus: Both, Ariana Grande]
So catch up 'cause you got an awful long way to go
So catch up 'cause you got an awful long way to go (Hey)

[Verse 2: Ariana Grande, MIKA & Both]
Always on the lookout for someone to hate
Pickin' on me like a dinner plate
You hid during classes and in-between 'em
Dunk me in the toilets, now it's you that cleans them
You tried to make me feel bad with the things you do
It ain't so funny when the joke's on you
Ooh, the joke's on you
Got everyone laughin', got everyone clappin', askin'
How come you look so cool?
'Cause that's the only thing that I learned at school, boy
Uh-huh, I said that's the only thing that I learned at school
You might also like[Pre-Chorus: MIKA & Ariana Grande]
My problem, I never was a model
I never was a scholar, but you were always popular
You were singin' all the songs I don't know
Now you're in the front row, 'cause my song is popular

[Chorus: MIKA, Both & Ariana Grande]
Popular, I know about popular
It's not about who you are or your fancy car
You're only ever who you were
Popular, I know about popular
And all that you have to do is be true to you
That's all you ever need to know (That's all you ever need to know)

[Post-Chorus: MIKA & Ariana Grande]
So catch up 'cause you got an awful long way to go
So catch up 'cause you got an awful long way to go

[Bridge: Ariana Grande & MIKA]
That's all you ever need to know
You're only ever who you were (Oh, baby)
That's all you ever need to know (Oh, baby)
You're only ever who you were (Hey, hey)
That's all you ever need to know (Ooh-ooh)
That's all you ever need to know
[Chorus: MIKA, Ariana Grande & Both]
Popular, I know about popular
It's not about who you are or your fancy car
You're only ever who you were
Popular, I know about popular (That's all you ever need to know)
It's not about who you are or your fancy car
You're only ever who you were (That's all you ever need to know)
Popular, I know about popular (That's all you ever need to know)
And all that you have to do is be true to you
That's all you ever need to know
That's all you ever need to know32Embed";99;0;1;0;0;0;spotify:track:1rIKgCH4H52lrvDcz50hS8
Team;Lorde;"TranslationsItalianoPortuguêsTeam Lyrics[Intro]
Wait till you're announced
We've not yet lost all our graces
The hounds will stay in chains
Look upon Your Greatness and she'll
Send the call out, send the call out
Send the call out, send the call out
Send the call out, send the call out
Send the call out, send the call out
Send the call out, send the call out
Send the call out, send the call out
Send the call out, send the call out
Send the call out, send the call out
[Verse 1]
Call all the ladies out
They're in their finery
A hundred jewels on throats
A hundred jewels between teeth
Now bring my boys in
Their skin in craters like the moon
The moon we love like a brother
While he glows through the room

[Pre-Chorus]
Dancin' around the lies we tell
Dancin' around big eyes, as well
Even the comatose
They don't dance and tell

[Chorus]
We live in cities you'll never see on-screen
Not very pretty, but we sure know how to run things
Livin' in ruins of a palace within my dreams
And you know, we're on each other's team

[Post-Chorus]
I'm kind of over gettin' told to throw my hands up in the air
So there
You might also like[Verse 2]
So all the cups got broke
Shards beneath our feet
But it wasn't my fault
And everyone's competing
For a love they won't receive
'Cause what this palace wants is release

[Chorus]
We live in cities you'll never see on-screen
Not very pretty, but we sure know how to run things
Livin' in ruins of a palace within my dreams
And you know, we're on each other's team

[Post-Chorus]
I'm kind of over gettin' told to throw my hands up in the air
So there
I'm kind of older than I was when I reveled without a care
So there

[Chorus]
We live in cities you'll never see on-screen
Not very pretty, but we sure know how to run things
Livin' in ruins of a palace within my dreams
And you know, we're on each other's team
[Outro]
We're on each other's team
And you know, we're on each other's team
We're on each other's team
And you know, and you know, and you know330Embed";100;0;1;3;0;0;spotify:track:7tRKpjlxvOcdi85DmP638d
Starving;Hailee Steinfeld;"Starving Lyrics[Verse 1]
You know just what to say, things that scare me
I should just walk away, but I can't move my feet
The more that I know you, the more I want to

[Pre-Chorus]
Somethin' inside me's changed
I was so much younger yesterday, oh

[Chorus]
I didn't know that I was starvin' 'til I tasted you
Don't need no butterflies when you give me the whole damn zoo
By the way, right away, you do things to my body
I didn't know that I was starvin' 'til I tasted you
By the way, right away, you do things to my body
I didn't know that I was starvin' 'til I tasted you
[Verse 2]
You know just how to make my heart beat faster
Emotional earthquake, bring on disaster
You hit me head on, got me weak in my knees

[Pre-Chorus]
Yeah, somethin' inside me's changed
I was so much younger yesterday, yeah
So much younger yesterday, oh, yeah

[Chorus]
I didn't know that I was starvin' 'til I tasted you
Don't need no butterflies when you give me the whole damn zoo
By the way, right away, you do things to my body
I didn't know that I was starvin' 'til I tasted you
By the way, right away, you do things to my body
I didn't know that I was starvin' 'til I tasted you

[Bridge]
You, you, yeah 'til I tasted you
By the way, right away, you do things to my body
I didn't know that I was starvin' 'til I tasted you
I didn't know 'til I tasted you

[Outro]
The more that I know you, the more that I want to
Somethin' inside me's changed
I was so much younger yesterdayYou might also like43Embed";100;0;0;0;1;0;spotify:track:3G6hD9B2ZHOsgf4WfNu7X1
Shallow;Lady Gaga;"
Tell me somethin', girl
Are you happy in this modern world?
Or do you need more?
Is there somethin' else you're searchin' for?

[Refrain: Bradley Cooper]
I'm fallin'
In all the good times
I find myself longing for change
And, in the bad times, I fear myself
[Verse 2: Lady Gaga]
Tell me something, boy
Aren't you tired tryna fill that void?
Or do you need more?
Ain't it hard keepin' it so hardcore?

[Refrain: Lady Gaga]
I'm falling
In all the good times
I find myself longing for change
And, in the bad times, I fear myself

[Chorus: Lady Gaga]
I'm off the deep end, watch as I dive in
I'll never meet the ground
Crash through the surface where they can't hurt us
We're far from the shallow now

[Post-Chorus: Lady Gaga & Bradley Cooper]
In the sha-ha, sha-hallow
In the sha-ha, sha-la-la-la-low
In the sha-ha, sha-hallow
We're far from the shallow now

[Bridge: Lady Gaga]
Oh, ha, ah, ha
Oh-ah, ha
You might also like[Chorus: Lady Gaga]
I'm off the deep end, watch as I dive in
I'll never meet the ground
Crash through the surface where they can't hurt us
We're far from the shallow now

[Post-Chorus: Lady Gaga & Bradley Cooper]
In the sha-ha, shallow
In the sha-ha, sha-la-la-la-low
In the sha-ha, shallow
We're far from the shallow now361Embed";96;1;1;0;0;0;spotify:track:4Ce37cRWvM1vIGGynKcs22
Rockin' Around The Christmas Tree;Brenda Lee;"Rockin Around The Christmas Tree Lyrics[Intro: Chorus]
Ahh-ahh-ahh

[Verse: Brenda Lee]
Rockin' around the Christmas tree
At the Christmas party hop
Mistletoe hung where you can see
Every couple tries to stop
Rockin' around the Christmas tree
Let the Christmas spirit ring
Later, we'll have some pumpkin pie
And we'll do some caroling
[Pre-Chorus: Brenda Lee & Chorus, both]
You will get a sentimental feeling when you hear
Voices singing, ""Let's be jolly (Ooo)
Deck the halls with boughs of holly!""

[Chorus: Brenda Lee]
Rockin' around the Christmas tree
Have a happy holiday
Everyone's dancing merrily
In the new old fashioned way

[Saxophone Solo]

[Pre-Chorus: Brenda Lee & Chorus, both]
You will get a sentimental feeling when you hear
Voices singing, ""Let's be jolly (Ooo)
Deck the halls with boughs of holly!""

[Chorus: Brenda Lee & Chorus]
Rockin' around the Christmas tree
Have a happy holiday
Everyone's dancing merrily
In the new old fashioned way (Ahh)You might also like9Embed";67;0;3;0;0;0;spotify:track:2VxeLyX666F8uXCJ0dZF8B
Work Bitch;Britney Spears;"TranslationsPortuguêsWork Bitch Lyrics[Intro]
You wanna?
You wanna?

[Chorus]
You want a hot body? You want a Bugatti?
You want a Maserati? You better work bitch
You want a Lamborghini? Sip martinis?
Look hot in a bikini? You better work bitch
You wanna live fancy? Live in a big mansion?
Party in France?
You better work bitch, you better work bitch
You better work bitch, you better work bitch
[Drop]
Now get to work bitch! (Ah-ah)
Now get to work bitch! (Ah-ah)

[Verse 1]
Bring it on, ring the alarm
Don't stop now, just be the champion
Work it hard like it's your profession
Watch out now, 'cause here it comes
Here comes the smasher, here comes the master
Here comes the big beat, big beat to blast ya
No time to quit now, just time to get it now
Pick up what I'm puttin' down, pick up what I'm puttin' down

[Chorus]
You want a hot body? You want a Bugatti?
You want a Maserati? You better work bitch
You want a Lamborghini? Sip martinis?
Look hot in a bikini? You better work bitch
You wanna live fancy? Live in a big mansion?
Party in France?
You better work bitch, you better work bitch
You better work bitch, you better work bitch

[Drop]
Now get to work bitch! (Ah-ah)
Now get to work bitch! (Ah-ah)
You might also like[Verse 2]
Break it up, break it down
See me comin' you can hear my sound
Tell somebody in your town
Spread the word, spread the word
Go call the police, go call the governor
I bring the treble, don't mean to trouble ya
I make it bubble up, call me the bubbler
I am the bad bitch, the bitch that you're lovin' up

[Bridge]
Hold your head high, fingers to the sky
They gon' try and try ya, but they can't deny ya
Keep it moving higher, and higher
Keep it moving higher, and higher
So hold your head high, fingers to the sky
Now they don't believe ya, but they gonna need ya
Keep it moving higher and higher
Keep it moving higher and higher and higher

[Post-Bridge]
Work, work, work, work
Work, work, work, work
Work, work, work, work
Work, work, work, work
Work it out, work it out, work it out, work it out
Work it out, work it out, work it out, work it out
Work it out, work it out, work it out, work it out
Work it out, work it out
[Drop]
You better work bitch
You better work bitch113Embed";128;2;2;2;0;1;spotify:track:2EjXfH91m7f8HiJN1yQg97
Work from Home;Fifth Harmony;"TranslationsPortuguês????????Work from Home Lyrics[Verse 1: Camila]
I ain't worried about nothin', I ain't wearin' na-nada
I'm sittin' pretty, impatient, but I know you gotta
Put in them hours, I'ma make it harder
I'm sendin' pic after picture, I'ma get you fired

[Pre-Chorus: Normani, Dinah]
I know you're always on the night shift
But I can't stand these nights alone (Oh-oh)
And I don't need no explanation
'Cause, baby, you're the boss at home
[Chorus: Lauren]
You don't gotta go to work
Work, work, work, work, work, work
But you gotta put in work
Work, work, work, work, work, work
You don't gotta go to work
Work, work, work, work, work, work
Let my body do the work
Work, work, work, work, work, work
We can work from home, oh-oh, oh-oh
We can work from home, oh-oh, oh-oh

[Verse 2: Ally, Ally & Dinah]
Let's put it into motion, I'ma give you a promotion
I'll make it feel like a vacay, turn the bed into an ocean
We don't need nobody, I just need your body
Nothing but sheets in-between us, ain't no getting off early

[Pre-Chorus: Dinah, Dinah & Camila, Camila]
I know you're always on the night shift
But I can't stand these nights alone (Oh-oh)
And I don't need no explanation
'Cause, baby, you're the boss at home (Yeah, yeah)

[Chorus: Lauren]
You don't gotta go to work
Work, work, work, work, work, work
But you gotta put in work
Work, work, work, work, work, work
You don't gotta go to work
Work, work, work, work, work, work
Let my body do the work
Work, work, work, work, work, work
We can work from home, oh-oh, oh-oh
We can work from home, oh-oh, oh-oh
You might also like[Bridge: Ty Dolla $ign]
(Dolla $ign) Oh, yeah
Girl go to work for me (Work for me)
Can you make it clap, no hands for me? (Oh, yeah)
Take it to the ground, pick it up for me
Look back at it all over me (Oh, yeah)
Put in work like my timesheet (Oh)
She ride it like a '63 (Oh-woah)
I'ma buy her new Céline (Oh, no)
Let her ride in a foreign with me
Oh, she the bae, I'm her boo
And she down to break the rules
Ride or die, she gon' go
I'm gon' juug, she finessin'
I pipe her, she take that
Put in overtime on your body

[Chorus: Lauren, Camila, Dinah, Lauren & Camila]
You don't gotta go to work (You don't gotta go to work, no)
Work, work, work, work, work, work
But you gotta put in work (Woah)
Work, work, work, work, work, work (Oh, yeah)
You don't gotta go to work
Work, work, work, work, work, work
Let my body do the work (Do the work, do the work)
Work, work, work, work, work, work (Yeah, yeah)
We can work from home, oh-oh, oh-oh
We can work from home, oh-oh, oh-oh
[Outro: Camila]
Yeah, we can work from home, ah
Yeah, we can work from home, oh-oh, oh-oh
Yeah58Embed";105;0;0;0;0;1;spotify:track:3KliPMvk1EvFZu9cvkj8p1
Gin & Juice;Snoop Dogg;"Gin and Juice Lyrics[Intro: Daz Dillinger & (Snoop Dogg)]
(Ugh) Ha-ha-ha, I'm serious, nigga
One of y'all niggas got some bad motherfuckin' breath
(Oh, man) Aye, baby, aye, baby, (shit) aye, baby
Get some bubblegum in this motherfucker or somethin'
Aye, nigga, get somethin' to eat, dog
Aye, nigga, study long, study wrong, nigga

[Verse 1: Snoop Dogg]
With so much drama in the L-B-C
It's kind of hard bein' Snoop D-O-double-G
But I, somehow, some way
Keep comin' up with funky-ass shit, like, every single day
May I kick a little something for the G's
And make a few ends as I breeze through?
Two in the mornin' and the party's still jumpin'
Cause my momma ain't home
I got bitches in the livin' room gettin' it on
And they ain't leavin' till six in the mornin'
So what you wanna do?
Shit, I got a pocket full of rubbers and my homeboys do too
So turn off the lights and close the doors
But (But what?) we don't love them hoes, yeah
So we gon' smoke an ounce to this
G's up, hoes down, while you motherfuckers bounce to this
[Chorus: Daz Dillinger & Lil David Ruffin, Snoop Dogg & Daz Dillinger]
Rollin' down the street, smokin' indo
Sippin' on gin and juice, laid back
With my mind on my money
And my money on my mind
Rollin' down the street, smokin' indo
Sippin' on gin and juice, laid back
With my mind on my money
And my money on my mind

[Verse 2: Snoop Dogg]
Now that I got me some Seagram's gin
Everybody got they cups, but they ain't chipped in
Now this type of shit happens all the time
You got to get yours but, fool, I gotta get mine
Everything is fine when you listening to the D-O-G
I got the cultivating music that be captivating he
Who listens to the words that I speak
As I take me a drink to the middle of the street
And get to mackin' to this bitch named Sadie (Sadie?)
She used to be the homeboy's lady (Oh, that bitch)
80 degrees, when I tell that bitch please
Raise up off these N-U-T's, cause you gets none of these
At ease, as I mob with the Dogg Pound
Feel the breeze beyotch, I'm just
You might also like[Chorus: Snoop Dogg & Daz Dillinger]
Rollin' down the street, smokin' indo
Sippin' on gin and juice, laid back
With my mind on my money
And my money on my mind
Rollin' down the street, smokin' indo
Sippin' on gin and juice, laid back
With my mind on my money
And my money on my mind

[Verse 3: Snoop Dogg]
Later on that day, my homie Dr. Dre
Came through with a gang of Tanqueray
And a fat ass J of some bubonic chronic
That made me choke; shit, this ain't no joke
I had to back up off of it and sit my cup down
Tanqueray and chronic, yeah, I'm fucked up now
But it ain't no stoppin', I'm still poppin'
Dre got some bitches from the city of Compton
To serve me; not with a cherry on top
Cause when I bust my nut I'm raising up off the cot
Don't get upset, girl, that's just how it goes
I don't love you, hoes, I'm out the door, and I'll be...

[Chorus: Snoop Dogg & Daz Dillinger]
Rollin' down the street, smokin' indo
Sippin' on gin and juice, laid back
With my mind on my money
And my money on my mind
Rollin' down the street, smokin' indo
Sippin' on gin and juice, laid back
With my mind on my money
And my money on my mind
Rollin' down the street, smokin' indo
Sippin' on gin and juice, beyotch
With my mind on my money
And my money on my mind
Rollin' down the street, smokin' indo
Sippin' on gin and juice, beyotch
With my mind on my money
And my money on my mind90Embed";95;2;2;3;2;0;spotify:track:4tCtwWceOPWzenK2HAIJSb
I Got Love;Nate Dogg;"I Got Love Lyrics[Produced By Bink!]

[Intro]
I got love... I got love...
I got love... I got love...

[Verse 1]
I got love - I, got, love, for, my homies who be rollin wit me
Play no game - play, no, games, cause, ain't nobody playin with me
I got love - I, got, love, for my niggas on my family tree
I got love - love for the ghetto, down for whatever
If you was down before, then you still gon' be down with me
I got game - I, got, game, cause, the game was given to me
Say my name - say, my, name, cause, ain't nobody tighter than me
Give it up - give, it, up, if, you like the way I'm rocking this beat
I don't know - know nuttin better, chasin my chedder
If you in love with a whore -- you ain't never listened to me
[Break]
Wah-ooooh, ooooh, oooh, oooh oooh oooh oooh oooh
Wah-ooooh, ooooh, oooh, oooh oooh oooh oooh oooh
Wah-ooooh, ooooh, oooh, oooh oooh oooh oooh oooh
Wah-ooooh

[Verse 2]
Captain save - cap-tain, save, a, hooker cause she hangin on me
She can't hang - she, can't, hang, cause I ain't lookin fo' a wifey
Just in case - just, in, case, I, better take a weapon wit me
And these hoes - hoes keep cover, down for whatever
If she stress me some more, I have to leave her dead in the street
Run me how? Run, me, how? Cause, haters they be all in the mix
And they know - where, they, go-in, ain't gon' get no better than this
Can't they see? Can't, they, see, we, ain't some niggas they wanna diss?
D.P.G. - though I'll love a trick never, treat a bitch never
I told you before, so you better not be fuckin with me

[Break]
Wah-ooooh, ooooh, oooh, oooh oooh oooh oooh oooh
Wah-ooooh, ooooh, oooh, oooh oooh oooh oooh oooh
Wah-ooooh, ooooh, oooh, oooh oooh oooh oooh oooh

[Verse 3]
Platinum chains - plat-inum, chains, is, all you ever see on my neck
Diamond ring - dia-mond, rings, as, long as I can keep her in check
All the same - all, the, same, as, long as you don't ever forget
I was taught in the ghetto, wear the tight bellow
If she head for the stash, I always got this pistol with me
Constantly we bustin' to a hell of a beat
Then we came - then, we, came, cause, the bass'll knock you off of your feet
Just that deep - just, that, deep, I, betcha we be movin ya feet
Voice kinda mellow, place from the ghetto
If you still want some more, go and get the fuckin CD
You might also like[Outro]
I got love... I got love...
I got love... I got love...
I got love... I got love...7Embed";90;0;0;2;0;0;spotify:track:0RvnQ7hMgtXeJn8VdEhKu1
